Question,Réponse,Valeur,Commentaire,Fichier Uploader,Sources
"Quels sont les principes fondamentaux qui régissent un appel d'offres ouvert ou restreint, et comment ces principes garantissent-ils la transparence et l'équité dans l'attribution des marchés publics ?"," Les principes fondamentaux qui régissent un appel d'offres ouvert ou restreint sont définis dans le Code de la commande publique, ainsi que dans diverses circulaires ministérielles. Voici quelques-uns des principes clés :

1. Transparence : Les appels d'offres doivent être publiques et les conditions et critères de sélection doivent être clairement définis pour permettre à tous les concurrents d'accéder aux mêmes informations. La dématernalisation des documents est un moyen d'assurer cette transparence, en facilitant l'accès aux documents nécessaires sur le portail des marchés publics.
2. Équité : Les concurrents doivent être traités de manière équitable, sans discrimination. La publication d'un avis d'appel d'offres doit intervenir au moins quinze jours avant la date fixée pour la tenue de la séance d'admission.
3. Sélectivité : Dans l'appel d'offres restreint, seuls les concurrents qui ont été invités par le maître d'ouvrage peuvent participer à la procédure.
4. Accessibilité aux documents et pièces nécessaires : Les documents nécessaires pour présenter une offre doivent être accessibles aux concurrents, soit sur place, soit sur le portail des marchés publics en cas de dématernalisation.
5. Conformité légale : Les entreprises qui souhaitent participer à un appel d'offres doivent présenter les attestations ou autorisations requises pour l'exécution des prestations objet du marché, conformément à la législation et la réglementation en vigueur.
6. Nationalité : Les entreprises non installées au Maroc sont tenues de fournir une attestation délivrée par une autorité compétente dans leur pays d'origine ou de provenance, pour participer à un appel d'offres lié aux besoins de la défense nationale ou de la sécurité publique.

Ces principes garantissent la transparence et l'équité dans l'attribution des marchés publics en assurant que tous les concurrents ont les mêmes chances et accès aux informations nécessaires, et que la procédure est équitable et conforme à la législation.",Positive,trés bien détaillé jjjjjjjjjjjjjjjjjjjjjjjjjjj,,"data\Decret_marches_publics_n_2_22_431_du_09_03_2023_Fr (7).pdf:67:2, data\Decret_marches_publics_n_2_22_431_du_09_03_2023_Fr (7).pdf:20:4, data\Decret_marches_publics_n_2_22_431_du_09_03_2023_Fr (7).pdf:22:4, data\Decret_marches_publics_n_2_22_431_du_09_03_2023_Fr (7).pdf:34:2, data\Decret_marches_publics_n_2_22_431_du_09_03_2023_Fr (7).pdf:68:3"
"Dans quelles circonstances un maître d'ouvrage peut-il recourir à un appel d'offres restreint, et quelles sont les conditions spécifiques à respecter pour ce type de procédure, notamment en termes de montant estimé des prestations et de nombre de concurrents consultés ?"," Le maître d'ouvrage peut recourir à un appel d'offres restreint dans certaines circonstances, notamment lorsque la nature et la particularité des besoins nécessitent de consulter un nombre limité de concurrents en raison de leur expertise spécifique. Cela se produit après avoir établi un programme fonctionnel des besoins.

   Pour une procédure d'appel d'offres restreint, le maître d'ouvrage doit respecter les conditions suivantes :

   - Le montant estimé des prestations ne peut excéder cinq millions de dirhams hors taxes.
   - Au moins trois concurrents susceptibles de répondre au mieux aux besoins doivent être consultés.
   - Le maître d'ouvrage doit établir un certificat administratif explicant les raisons qui l'ont conduit à choisir cette procédure.

   Il existe plusieurs types d'appels d'offres restreints : ""au rabais ou à majoration"" et ""sur offres de prix"". Dans le cas d'un appel d'offres ""au rabais ou à majoration"", le concurrent s'engage à exécuter les prestations en fonction du rabais ou des majorations qu'il peut négocier avec le maître d'ouvrage.

   Enfin, le maître d'ouvrage doit informer les concurrents lorsqu'un report de la date prévue est effectué et publier l'appel d'offres dans les circonstances prévues par le décret.",Négative,NAN,loi_n-05.20.pdf,"data\Decret_marches_publics_n_2_22_431_du_09_03_2023_Fr (7).pdf:12:3, data\Decret_marches_publics_n_2_22_431_du_09_03_2023_Fr (7).pdf:49:7, data\Decret_marches_publics_n_2_22_431_du_09_03_2023_Fr (7).pdf:20:5, data\Decret_marches_publics_n_2_22_431_du_09_03_2023_Fr (7).pdf:19:7, data\Decret_marches_publics_n_2_22_431_du_09_03_2023_Fr (7).pdf:16:3"
